,videoId,IdUser,text,ReplyCount,likeCount,publishedAt
0,oV2Tg3CQ9gI,UgwJuktpF9APqq7FveJ4AaABAg,Itte mirip Shania,0,0,2022-05-11T23:36:45Z
1,oV2Tg3CQ9gI,UgxsHHXGylASQQu5rzZ4AaABAg,"gila gila, provinsi induk Kalimantan Utara masa ga tau 😅",0,0,2022-05-11T00:23:52Z
2,oV2Tg3CQ9gI,Ugzxw13SwK8VazP3G2p4AaABAg,Kapan eps terbarunya kluar bang?,0,0,2022-05-10T15:29:51Z
3,oV2Tg3CQ9gI,Ugw_KIbDWz9dbgVQENd4AaABAg,Pajak resto bukannya masuk pajak daerah bukan PPN ya?,0,0,2022-05-10T13:29:07Z
4,oV2Tg3CQ9gI,UgxfUm11xFIIelo2uL54AaABAg,Lanjutannya mana?? :((,0,0,2022-05-10T10:52:46Z
5,oV2Tg3CQ9gI,UgzvsF-0xAezlWKUTRt4AaABAg,Final mana nihhh blm di upload,0,0,2022-05-09T12:47:27Z
6,oV2Tg3CQ9gI,UgzSzMuY9z98AtlOLXx4AaABAg,"Kalo ada twk, apakah nanti ada tiu?yg versi hots kalo bisa pasti jd ikut belajar ngerjain soal juga apalagi kalo dekat2 tanggal kayak UN, UTBK, CPNS dll 🤔",0,0,2022-05-09T10:48:31Z
7,oV2Tg3CQ9gI,UgzZoWZJaZw_GAAJS5l4AaABAg,Next episode kapan diunggah kak?,0,0,2022-05-09T08:08:07Z
8,oV2Tg3CQ9gI,UgyJFn5iSmao_-aV0f14AaABAg,Viewnya semakin sedikit hmm,0,0,2022-05-08T13:13:06Z
9,oV2Tg3CQ9gI,Ugz2IZ3cSdhgCvZHmSl4AaABAg,"TWK harus banget ada sih, menambah wawasan kebangsaan banget, ditunggu episode berikutnyaaa",0,1,2022-05-07T05:47:37Z
10,oV2Tg3CQ9gI,UgwLC6_qW9cxO1kXwXp4AaABAg,Kok belum upload lagi kak?🥺,0,0,2022-05-06T15:23:09Z
11,oV2Tg3CQ9gI,UgwtuZRgw_XBjRHt2VV4AaABAg,serruuuu. nmbh pengetahuan,0,0,2022-05-05T15:27:46Z
12,oV2Tg3CQ9gI,UgxY6mvcsUww3d9GtOd4AaABAg,Next final sama2 pintar🤩🤩🤩 pns dan politikus muda,0,0,2022-05-05T04:45:33Z
13,oV2Tg3CQ9gI,Ugzb7VzBpWjrQT6jZvl4AaABAg,"Dear Tim Kreatif TWK, sebentar lagi sudah memasuki babak semi final dan final jadi tolong koreksi lagi proporsi soal dan bentuk soalnya. Sangat tidak etis jika pertanyaan benar salah muncul di pertanyaan lemparan. Apalagi tragedi nama band di babak akhir.",0,0,2022-05-04T11:11:45Z
14,oV2Tg3CQ9gI,UgyvlAN4zTX_TpUyCpt4AaABAg,episode PNS VS Politikus muda seru bgt si ntr kyknya,0,0,2022-05-04T00:36:37Z
15,oV2Tg3CQ9gI,UgzJGyhhcfImDEcYEnt4AaABAg,manteeeppppp bangettt<br>dah yakin sih tim pns bisa jawab,0,0,2022-05-03T12:46:01Z
16,oV2Tg3CQ9gI,UgywCRjpCllxWQ-LD7J4AaABAg,"Harusnya udh bener kaya babak ini berhenti sampai babak 2 atau kl mau ada babak 3 diganti jadi kaya cerdas cermat (?) Gitu yg cepet-cepetan jawab karena nama band di episode ojol tuh :&quot;) wkwkwkw<br><br>Tapi seru sih ini tim pns, lawan tim politikus muda bakal jd episode epic bgt aku kalo jadi di antara 2 tim ini under pressure pasti HAHAHAHA buka2 buku bacaan 🤣 dua duanya &#39;mengemban&#39; nama negara AHAHAH semoga twk selalu ada season 2-3-4 dst please kakkk hahaha asli pengen ikut 😂",0,0,2022-05-03T08:53:32Z
17,oV2Tg3CQ9gI,UgzWgusKn8kaZAoiFjB4AaABAg,Di tunggu,0,1,2022-05-03T04:26:01Z
18,oV2Tg3CQ9gI,UgyQHQXKKZUpG0VWbs94AaABAg,Bikin terus ya kak,0,1,2022-05-03T04:25:54Z
19,oV2Tg3CQ9gI,Ugy0ZzIYPixrDcx4KUl4AaABAg,Bagus banget acaranya,0,1,2022-05-03T04:25:43Z
20,oV2Tg3CQ9gI,Ugxr9-1dgBRdsUIktaB4AaABAg,Karna twk saya subscribe,0,0,2022-05-02T10:06:45Z
21,oV2Tg3CQ9gI,UgwLhqwkmD48YupSYCB4AaABAg,Salfok sama pertanyaan terakhirnya yang nambah jadi 11% buat nambah pendapatan negara a.k.a nutup utang,0,2,2022-05-02T07:34:51Z
22,oV2Tg3CQ9gI,Ugyrff5ibFmiIi6-oc94AaABAg,Model bukan lawan pns yg seimbang nihh,0,0,2022-05-01T04:28:53Z
23,oV2Tg3CQ9gI,Ugy-BqMpsNoGGJc6wH94AaABAg,TERBANTAI,0,0,2022-05-01T04:11:33Z
24,oV2Tg3CQ9gI,UgxX1Ip_sbkqrAx6OHF4AaABAg,ga tau pembawaan kajo gak kaya biasanya. sekarang kaya terlalu tergesa gesa,0,3,2022-05-01T03:50:42Z
25,oV2Tg3CQ9gI,Ugy4B2ol8YJmlljp_K54AaABAg,Terus berkarya,0,3,2022-05-01T03:03:05Z
26,oV2Tg3CQ9gI,Ugz2SyvQVEgf3rTnFn14AaABAg,"<a href=""https://www.youtube.com/watch?v=oV2Tg3CQ9gI&amp;t=18m11s"">18:11</a> Maafin gue ngakak sama pertanyaann mbanya, &quot;emang Roma Irama Penyanyi Dangdut?&quot; Raja yg terlupakan",0,7,2022-05-01T02:25:51Z
27,oV2Tg3CQ9gI,UgzxzA4K9buAOfxOgmh4AaABAg,anjrit ini eps selanjutnya bakalan seru bat sih politikus muda vs pns😍😍😍,0,10,2022-05-01T00:57:59Z
28,oV2Tg3CQ9gI,UgxnalCtqqtXjcT6M4R4AaABAg,Bagus sekali ini acaranya,0,3,2022-05-01T00:38:33Z
29,oV2Tg3CQ9gI,UgzWZtPDD1E1Bh5iVwJ4AaABAg,Lanjutkan terus kak acaranya ini,0,4,2022-05-01T00:38:12Z
30,oV2Tg3CQ9gI,UgzDZ-awqC7Eszf-Btl4AaABAg,"Izin mengoreksi team narasi, sependek pengetahuan saya komisi yudisial bukan dalam wilayah lembaga yudikatif kerena fungsi lembaga yudikatif adalah melaksanakan peradilan sementara KY hanya mengawasi hakim.",1,2,2022-04-30T23:22:21Z
31,oV2Tg3CQ9gI,UgwckGkYWGDNSzUPfol4AaABAg,Tim pns menang telak krn bener2 ngalamin twk yg jauh lbh sulit in real life 😂 so do i. Jd yg beginian mah cetek buat para pns. Wkwkkw. Fun games btw. Sering2 ya ngadain ginian narasi 😘,1,19,2022-04-30T22:42:27Z
32,oV2Tg3CQ9gI,Ugwh6xuWb2ttTDrhWMB4AaABAg,Du,0,1,2022-04-30T21:42:52Z
33,oV2Tg3CQ9gI,Ugxh4EviNUrQXwtVZjp4AaABAg,"Amplang kebanyakan pakai ikan hambir semua daerah, seharusnya pilihannya nama-nama ikannya",0,1,2022-04-30T21:42:35Z
34,oV2Tg3CQ9gI,UgyjcpoxCE7aob0E-CN4AaABAg,Pengen ikutan tp bukan siapa2 bisa ga ya,0,2,2022-04-30T21:33:12Z
35,oV2Tg3CQ9gI,UgyQExVSU6SEulPLMOp4AaABAg,FINAL COMIKA VS PNS!,0,1,2022-04-30T20:59:00Z
36,oV2Tg3CQ9gI,UgzVdNDI5YIOLgcp3gl4AaABAg,Rama sonta mengecoh roro jongrang? Lulus pns jalur 150jt? 🤣,0,1,2022-04-30T20:56:38Z
37,oV2Tg3CQ9gI,UgxePsjZEjd6R0xLoEh4AaABAg,SERU NI TIM POLITIKUS MUDA VS TIM PNS🔥,0,7,2022-04-30T16:47:56Z
38,oV2Tg3CQ9gI,Ugxwce9Ui2TuAcz0QOF4AaABAg,seru.. informatif,0,1,2022-04-30T15:31:12Z
39,oV2Tg3CQ9gI,UgybyZIiD1QPK4IoFOd4AaABAg,Keren banget ludya,0,1,2022-04-30T15:19:27Z
40,oV2Tg3CQ9gI,UgztLTTL_ItqaPvP5qV4AaABAg,Semifinal: K-POP Vs Komika ibarat Villarreal Vs Atalanta sedangkan Politikus Vs PNS ibarat Manchester City Vs Liverpool.,1,8,2022-04-30T15:06:17Z
41,oV2Tg3CQ9gI,Ugz_sJdf3WtwJ-qMOmF4AaABAg,pembantaian ini wkwk,0,1,2022-04-30T15:03:29Z
42,oV2Tg3CQ9gI,Ugy3_U62Va6H2rAZhUt4AaABAg,"Konten yang gua tunggu tunggu, setiap ada pertanyaan pasti ikut ikut jawab , keren si ini",0,5,2022-04-30T14:53:27Z
43,oV2Tg3CQ9gI,UgxhPdlsYytGnbyC8ed4AaABAg,"Pertanyaannya kadang aneh, pentingnya sarinah pake eskalator pertama apa. Pilihannya juga kadang sgt keliatan bedanya, kurang ngecoh",1,5,2022-04-30T14:51:09Z
44,oV2Tg3CQ9gI,Ugza9ZRTolAiW4C64mZ4AaABAg,"sepertinya, tidak ada yang pernah menyadari bahwa saat ada petunjuk jika mengumpulkan tambahan point dari kelengkapan menjawab semua provinsi di 1 pulau, kenapa pihak narasi dan peserta tidak ngeh dengan pulau Bali, Nusa tenggara dan Maluku. Kan hanya 1-2 provinsi. tapi bisa dapat tambahan point 3 di akhir game. ini malah sibuk ngejar pulau jawa yang banyak provinsinya wkwkkw. atau hanya pemikiran aku aja yaaa",4,19,2022-04-30T14:41:26Z
45,oV2Tg3CQ9gI,UgzgawUUpUSWwk_ENUJ4AaABAg,Berharap adain tim comeback tim ojol undang lagi gamau tau entah kebingungan tim kreatif atau apapun pokoknya kak Jo yang tanggung jawab ngasih soal ampas grup band Indonesia 🤣,4,83,2022-04-30T14:33:50Z
46,oV2Tg3CQ9gI,UgxUmoz2si0h88XXJa54AaABAg,"Tim pns udah bener2 ngalamin tes twk, kalo ini mah bukan tes twk tapi kuis wawasan kebangsaan lebih tepatnya. Jadi faktor luck banyak berpengaruh kalo ini. Kalo dikasih tes twk buat daftar cpns udah pasti tim pns makin jadi favorit",0,20,2022-04-30T14:21:47Z
47,oV2Tg3CQ9gI,Ugx5Isg-ybsTjVjt6yt4AaABAg,"YUKK FINAL KOMIKA VS PNS🤣 tapi siapapun yang menang, aku dukung yang menang🤣",0,4,2022-04-30T13:51:38Z
48,oV2Tg3CQ9gI,UgwDNP_6v9Qbvtl75YV4AaABAg,"😅untunglah bukan team model, kalau ga pas semi final pertandingan sama team pm udah pasti bakal kalah brutal 🤣(adapun hasil finalnya ud kelar ini mah)",0,1,2022-04-30T13:46:27Z
49,oV2Tg3CQ9gI,UgzgqaVsiHacFz5qsG54AaABAg,PNS jangan kalah,0,3,2022-04-30T13:28:18Z
50,oV2Tg3CQ9gI,Ugxb4jK8NPFbtL9aX-h4AaABAg,"Acara yang sangat menarik untuk ditonton. Tapi kalo saya boleh usul, dibabak ke 3 menurut saya dengan nilai +3 untuk satu orang itu terlalu banyak, karena dibabak tersebut menurut saya sudah bukan murni karena pengetahuan tetapi ada unsur nervous dan tekanan yang lebih besar , menurut saya setiap orang yang tersisa dinilai dengan +2 sudah lebih dari cukup, karena ini kan game bisa dipastikan ketat setiap gamenya, sehingga dengan tambah +3 atau bisa +6, bahkan +9 rasanya terlalu banyak untuk tim lain menyusul ketika sedang kalah. Jadi apa yang sudah diperjuangkan salah satu tim di babak ke 1-2 jadi sia sia karena cuma kalah karena hal seperti itu, bahkan tim ojol kalah gara gara NAMA BAND INDONESIA? Hmm, atau saran terakhir mungkin beri pertanyaan yang lebih umum tentang negara, seperti kemaren nama kementrian, itu menurut saya bagus karena emang itu pengetahuan buat semua. Kalo nama Band? Hmm agak gimana ya karena bisa aja salh satu dari mereka gasuka musik. Terimakasih, semoga bisa menjadi masukan yang baik, sukses selalu🙏🏻",18,171,2022-04-30T12:58:10Z
51,oV2Tg3CQ9gI,UgxgrGkxf9d4JDtX0TF4AaABAg,Walaupun udah mudik ttp hrs nonton TWK,0,7,2022-04-30T12:50:02Z
52,oV2Tg3CQ9gI,UgzoAslyKXumFFKV74J4AaABAg,Andai tes CPNS pertanyaanya kek gini mungkin gw udah lulus pas nyoba pertama kali wkwk,0,4,2022-04-30T12:31:09Z
53,oV2Tg3CQ9gI,UgyDpBbroV9tCJYxPVt4AaABAg,TWK adain lagi dong,0,1,2022-04-30T11:53:24Z
54,oV2Tg3CQ9gI,Ugwii6u-RyDbNh19Jsd4AaABAg,Seruuuu sekaliiii🤘,1,4,2022-04-30T11:44:24Z
55,oV2Tg3CQ9gI,UgyqQVxbF3xeOuvQ9PF4AaABAg,Fix PNS akan menjadi juara TWK!!,0,4,2022-04-30T11:37:05Z
56,oV2Tg3CQ9gI,UgxwyEfNY1rf0zOuPv94AaABAg,"<a href=""https://www.youtube.com/watch?v=oV2Tg3CQ9gI&amp;t=17m50s"">17:50</a> kakaknya bilang sumatera selatan. Tapi di peta sulawesi selatan 😂",2,6,2022-04-30T11:29:35Z
57,oV2Tg3CQ9gI,Ugw1PTAoRAihqIKODBJ4AaABAg,Komika Vs PNS asik keknya. Soalnya bakal di roasting lagi kalau menang,0,6,2022-04-30T11:28:03Z
58,oV2Tg3CQ9gI,UgwpcwVnKaP5Rr3Uv9t4AaABAg,jagoan w politikus muda,1,3,2022-04-30T11:14:45Z
59,oV2Tg3CQ9gI,UgxQD3Pd7hVJCbJWEeB4AaABAg,Kayaknya<br><br><br>Semifinal<br>= Komika vs Kpop<br>= Politikus Muda vs PNS<br><br>Final<br>= Kpopers vs PNS,3,12,2022-04-30T11:08:58Z
60,oV2Tg3CQ9gI,UgwaOMhXU763I6h7fMt4AaABAg,TWK HARUS ADA TIAP TAHUN!,7,99,2022-04-30T11:08:52Z
61,oV2Tg3CQ9gI,Ugz7BGzWek_ESJfhee94AaABAg,Kak kalo ada season 2 twk masukin tim ormas dong 😆,2,30,2022-04-30T11:04:26Z
62,oV2Tg3CQ9gI,UgwFENMd74Mg4Hk_M5d4AaABAg,Masih nyesek sama tim ojol yang kalah karna &quot;nama band Indonesia&quot;<br>Saran lain kali pertanyaan babak terakhir harus relevan semua usia.,5,102,2022-04-30T11:02:57Z
63,oV2Tg3CQ9gI,UgxKu2Wjgj4ipB2X6cZ4AaABAg,"Felicidades, es un buen ejemplo.  4  sentadillas son unos <a href=""http://kimmy-jka.monster/"">Kimmy-jka.Monster</a> muchas y un buen ejercicio.  Se deja ver que hay muy buenos resultados 😍👍 Saludos desde la Cd.. de world 🌹😉💖  los mortalesd abian apreciado tan hermosa mujer.k",0,1,2022-04-30T11:00:27Z
64,oV2Tg3CQ9gI,Ugzj4vw_AB_8f3SO_9x4AaABAg,Tumben masih dikit yg komen,0,1,2022-04-30T10:59:11Z
65,oV2Tg3CQ9gI,UgznZTCorpnMdERzMlh4AaABAg,Kece nih menang telak,0,4,2022-04-30T10:52:48Z
66,oV2Tg3CQ9gI,UgxSPHkCBEZtfZIxp9N4AaABAg,Udah jelas yang juara PNS,0,4,2022-04-30T10:45:36Z
67,oV2Tg3CQ9gI,UgxhElFVU0ZLWZW7ahN4AaABAg,Nungguin semi final,0,1,2022-04-30T10:42:09Z
68,oV2Tg3CQ9gI,UgxZb7MaFlJ0waU-t7h4AaABAg,seru nih politikus muda vs pns,0,8,2022-04-30T10:34:48Z
