,videoId,IdUser,text,ReplyCount,likeCount,publishedAt
0,VIHkCb3d_uU,Ugx4e1soXxxL7XaOFUZ4AaABAg,"Seru nih,, mudah2an ada TWK season 2,, saya siap ikutan dari kategori Karyawan BUMN",0,0,2022-05-16T11:34:36Z
1,VIHkCb3d_uU,UgzrQFRNxFTebOVUA-V4AaABAg,tim pensiunan kerenn,0,0,2022-05-16T05:38:05Z
2,VIHkCb3d_uU,UgyM9NsUsfBMYf1noa14AaABAg,jujur ini programnya keren banget sihh....,0,0,2022-05-16T03:28:09Z
3,VIHkCb3d_uU,UgzHjxJoDDAhaK_mzC14AaABAg,PALING SUKA KEDUA TIM INIIIIII,0,0,2022-05-15T14:19:39Z
4,VIHkCb3d_uU,UgzGHJf3juVioLqArMh4AaABAg,PALING SUKA KEDUA TIM INIIIIII,0,0,2022-05-15T14:19:24Z
5,VIHkCb3d_uU,UgwaAN92UZP5JKLFkiJ4AaABAg,"Babak terakhirnya kurang fair sih, itu orang udah pada tua wkwkwkwkw",0,0,2022-05-15T08:41:46Z
6,VIHkCb3d_uU,UgxX6LlOIqyZHBTJrnN4AaABAg,"Babak ketiga adalah WIT yaitu Waktu Indonesia Tangkas. Mungkin maksudnya adalah ketangkasan yang diutamakan, makanya soalnya sedikit lebih mudah tetapi harus cepat dalam berpikir untuk menjawabnya.",0,1,2022-05-14T14:21:52Z
7,VIHkCb3d_uU,Ugx4nJ2HDbO3GGQ43F14AaABAg,Kurang tangkas aja karna udah tua wkwk,0,0,2022-05-13T15:33:12Z
8,VIHkCb3d_uU,UgzPH5tKht5czywaj1t4AaABAg,"Tim Politikus Muda terlalu OP, bagus next season para politikus dan akademisi, dan orang-orang ahli lainnya di banned aja biar fair. Karena buat mereka pertanyaannya mayoritas terlalu mudah",0,0,2022-05-13T14:32:34Z
9,VIHkCb3d_uU,UgwmD0l9dh_pvjxr1jN4AaABAg,Babak ketiga mungkin bisa di ganti dengan format rebutan min🙏,0,0,2022-05-13T08:39:53Z
10,VIHkCb3d_uU,UgyPuo9-YSLYik-Z02R4AaABAg,Babak ketiga mungkin bisa di diskusi kan lagi format nya🙏,0,0,2022-05-13T08:32:48Z
11,VIHkCb3d_uU,UgyaDdhwidtfrB953Mx4AaABAg,FYI : Bangka Belitung itu nama resminya adalah Kepulauan Bangka Belitung (Bantu up biar dibaca),0,1,2022-05-13T03:52:27Z
12,VIHkCb3d_uU,Ugy0vJ1A2cN9Z9aJ4MV4AaABAg,Sengit politikus v pns,0,0,2022-05-12T09:44:43Z
13,VIHkCb3d_uU,UgyDXcAl7mct3tTFcWd4AaABAg,"Pertanyaan untuk Politikus Muda gampang2, gue gak perlu mikir buat jawab, tapi pas pertanyaan untuk Pensiunan banyak yang susah",0,0,2022-05-10T14:34:59Z
14,VIHkCb3d_uU,Ugxvk11B7Zs9G2QztV54AaABAg,WIT emng pasti sulit untuk pensiunan sih,0,0,2022-05-09T11:54:42Z
15,VIHkCb3d_uU,UgyiRfgVHG5bee64JXt4AaABAg,Tontonan yang sangat seru,0,0,2022-05-09T03:42:10Z
16,VIHkCb3d_uU,UgymaOWuqBNIGkb_x9R4AaABAg,big big big respect untuk para bapak tim pensiunan. episode kali ini juga sangat menarik untuk ditonton karena kedua tim memiliki pengetahuan yang luas. salut sekali untuk tim pensiunan dan tim politikus muda👍🏻<br><br>acaranya juga menarik karena sudah lama engga nonton kuis berbobot seperti ini. big respect juga untuk tim TWK🙏🏻,0,1,2022-05-04T03:12:16Z
17,VIHkCb3d_uU,UgxNLUByfRYHXszGMsF4AaABAg,Akan ada season selanjutnya gk ya? Cara daftarnya gmn?,0,0,2022-05-03T07:21:19Z
18,VIHkCb3d_uU,UgzGQ6tvqOOLK0ldrNp4AaABAg,"<a href=""https://www.youtube.com/watch?v=VIHkCb3d_uU&amp;t=17m34s"">17:34</a> TAPI BOONG 😂😂😂",0,0,2022-05-03T01:33:55Z
19,VIHkCb3d_uU,UgwhbvcMxGd8t7zI_8R4AaABAg,"<a href=""https://www.youtube.com/watch?v=VIHkCb3d_uU&amp;t=3m28s"">3:28</a> UMKM itu Usaha Memang Kesulitan Modal Broo 😂",0,0,2022-05-03T01:15:01Z
20,VIHkCb3d_uU,Ugx7UfRhwrRLy2pMHuR4AaABAg,"Suka bgt Sama episode ini. Secara pribadi emang Dari awal udah seneng Sama kedua Tim Sih jadi bingung dukung yg mana. Plus menurutku Di babak ini pertanyaan nya lebih beragam Dari babak&quot;sebelumnya. Sama Aku suka bgt TWK INFO, berguna bgt. Semangatt Tim kreatif narasi TWK!! Suka bgttt",0,0,2022-05-01T17:29:57Z
21,VIHkCb3d_uU,UgxAjyi7OfJeamvn9mF4AaABAg,Mending babak 3 diganti. Ditambah pake bel. Cepat2an. Siapa yang pencet duluan mereka bisa jawab dapat point,0,0,2022-04-30T07:44:31Z
22,VIHkCb3d_uU,UgxV9AQFpq90ZRZxYm94AaABAg,EZ banget dah pertanyaan tentang pulau Jawa. Harusnya hardcore dikit bobot pertanyaan nya. Kalo gini terus tinggal pilih provinsi Jawa aja terus nanti juga menang,0,0,2022-04-29T12:44:08Z
23,VIHkCb3d_uU,UgwlBv4Me6N1aS8gITJ4AaABAg,"Kalo saya bilang babak WIT kurang adil, krn kalo 1 tim tidak familiar sama topiknya bakalan langsung habis, seandainya tiap ada yg keluar topiknya diganti jadi lebih adil",0,0,2022-04-29T07:37:56Z
24,VIHkCb3d_uU,UgweJhFiy1lloTDO8m94AaABAg,Pertarungan yang paling the best mnurut saya🔥🔥,0,0,2022-04-28T11:08:05Z
25,VIHkCb3d_uU,UgyHKAXb1a3ViKFKkch4AaABAg,babak terakhirnya AGAK ngeselin banget yaa,0,0,2022-04-27T15:14:23Z
26,VIHkCb3d_uU,UgxWD3KBMsvF3ZHigD54AaABAg,Babak akhir lol,0,0,2022-04-27T01:07:21Z
27,VIHkCb3d_uU,Ugzt5bDemmlZcvx0Zrt4AaABAg,"Kan babak 3 ini ga efektif bangett, dari pertandingan kemarin juga ojol kalah gara gara babak 3 padahl udah unggul.",0,0,2022-04-26T16:19:45Z
28,VIHkCb3d_uU,Ugztfprwb7hRz3dVeZp4AaABAg,Lebih baik babak ketiga menjadi babak penentu pemenang jika di babak kedua imbang,0,0,2022-04-25T23:41:37Z
29,VIHkCb3d_uU,UgxgilZjeqDZSrGKLwl4AaABAg,"babak ketiga menurut saya kurang adil pemberian poin dan sistem permainannya, mungkin segmen waktu indonesia tangkas bisa berisi 5 soal dengan dijawab cepat aja dan jawaban benar dikasih bobot nilai maksimal 2-3, soalnya dari kedua game babak perempat final poin-poinnya tidak terpaut terlalu jauh",0,5,2022-04-25T23:08:29Z
30,VIHkCb3d_uU,UgyiD5mR4Yt03WMyb8p4AaABAg,Om om pensiunan keren banget,0,0,2022-04-25T20:23:42Z
31,VIHkCb3d_uU,UgzTsn8fchgfvbeouCV4AaABAg,Politikus muda jawa sentris,0,0,2022-04-25T18:25:18Z
32,VIHkCb3d_uU,UgyedDz4hds8eKzlztB4AaABAg,"IKUT GREGET,TIM PENSIUNAN TIDAK KALAH GOKILL!!🤩",0,2,2022-04-25T15:17:48Z
33,VIHkCb3d_uU,UgxS8xlFejj6t3nRv354AaABAg,Kayanya tim narasi harus mengajak Helmy Yahya untuk bikin soalnya biar lebih variatif,0,0,2022-04-25T12:51:23Z
34,VIHkCb3d_uU,Ugxf-AaH2Y1zy5SU0B14AaABAg,Pertanyaannya tidak sesuai dengan Babaknya...,0,0,2022-04-25T12:28:33Z
35,VIHkCb3d_uU,Ugx_-rkgscJUs53ztd14AaABAg,HOKI TIM POLITIKUS TUH,0,0,2022-04-25T04:22:30Z
36,VIHkCb3d_uU,Ugy8sYEl_783GTXdHyZ4AaABAg,yg dipolitikus knp gampang2 sih,0,0,2022-04-25T04:00:05Z
37,VIHkCb3d_uU,UgxxSPR0w1dkYBJGBLV4AaABAg,Tim politikus muda hoki kek nya ya 😂 pertanyaan nya lebih banyak yg mudah,0,2,2022-04-25T03:08:02Z
38,VIHkCb3d_uU,Ugyz5whRr2-trUYhl_F4AaABAg,And again babak ketiga gak fair kasian om pensiunan dah tua jd nangkepnya lama.,0,1,2022-04-25T00:53:34Z
39,VIHkCb3d_uU,Ugw_1PzaY4G0uv7Nn754AaABAg,Ga seru bgt babak 3😭 ahhh,0,0,2022-04-24T19:21:32Z
40,VIHkCb3d_uU,UgzBzXvmhm_myZUoIHR4AaABAg,Ampunnn om om pensiunan pinter pinter bgt😭😭😭 mana pertanyaannya banyakan bukan pertanyaan basic,0,0,2022-04-24T19:17:35Z
41,VIHkCb3d_uU,UgwkAwFawSv7F-rs77h4AaABAg,OM PENSIUNAN KEREN.,0,0,2022-04-24T18:25:10Z
42,VIHkCb3d_uU,UgySl0cY8HMJQd4eOBV4AaABAg,"Acaranya bagus banget, tapi ada yang aneh dengan peraturannya.. seharusnya bonus menguasai pulau di akhir babak aja. Tadi Tim politikus menguasai jawa harus direbut dulu sama tim pensiunan, tapi pas tim pensiunan dapat sulawesi, langsung dapat bonus. Coba deh dipikirin lagi. Good job anyway",0,2,2022-04-24T16:35:00Z
43,VIHkCb3d_uU,UgyshtXggk9d0nO18Mh4AaABAg,Sedihhhhh bangett Tim Pensiuan kalah,0,0,2022-04-24T12:29:57Z
44,VIHkCb3d_uU,UgzD_Ft919Nzt46xOaF4AaABAg,“Bagaikan katak dalam tempurung” wkwkw nyindir tim politikus muda banget,0,0,2022-04-24T12:14:29Z
45,VIHkCb3d_uU,UgxUtemoBkd5P6MKidh4AaABAg,Babak ketiga mending diganti konsepnya seperti cerdas cermat siapa yang pencet bel duluan gitu dah,0,0,2022-04-24T11:48:43Z
46,VIHkCb3d_uU,UgxYOYABdjzkHYUCb8t4AaABAg,Kuis 3 menurut saya kurang adil,0,1,2022-04-24T09:23:38Z
47,VIHkCb3d_uU,UgwESUmkhEZzMm9m5Od4AaABAg,Sebel bgt si sama round 3 nya,0,0,2022-04-24T08:32:38Z
48,VIHkCb3d_uU,Ugx8pIllPLgf32YGDmZ4AaABAg,"Pertanyaan buat politikus terlalu mudah, haruse udah perempatfinal dikasih yg susah susah",0,0,2022-04-24T06:15:08Z
49,VIHkCb3d_uU,Ugy3UFUleWhPwQpvn-N4AaABAg,Kalo yg buat soal bung Pange pasti bakal lebih susah dan seru.,0,0,2022-04-24T05:27:22Z
50,VIHkCb3d_uU,Ugz3aSeOXrIU78cOFup4AaABAg,keren semuaaa!!!,0,0,2022-04-24T04:12:48Z
51,VIHkCb3d_uU,UgwdfZMZspIxEeRmM194AaABAg,Jujur kurang suka kalau udah masuk babak ke 3 🙏,0,0,2022-04-24T03:34:46Z
52,VIHkCb3d_uU,UgxxJuzC_hDuNaPSqN54AaABAg,"Mantap politikus muda.<br>Bang Anggo, dkk.",0,1,2022-04-24T03:17:03Z
53,VIHkCb3d_uU,Ugz2FAQqQ89dqeWDFSt4AaABAg,Asli pada pinter2 bangetttt<br>Semua jawaban memang ada pengetahuannya dr masing2 team nya.<br>Keren 🥳🥳🥳🥳,0,4,2022-04-24T02:32:46Z
54,VIHkCb3d_uU,Ugz3VLxlcEcGHzQk4Bt4AaABAg,"Mantappp tim narasiii pasti sudah menggodok soalnya dengan baikk, selain tim ojol fav juga tim pensiunan tapi sayang belum saatnyaa menang, terimakasih atas wawasan barunya om, karena saat memilih jawaban beliau memberikan penjelasan disetiap jawaban, and its important for me. Kalau boleh saran kak, untuk babak 3 bisa diganti atau jawaban bisa ditampilin di layar, karna terdpt banyak faktor yg menyebabkn kegagalan yg tidk terduga di babak teesebut, semangatt kak 🔥👍🏻",0,2,2022-04-24T02:07:29Z
55,VIHkCb3d_uU,Ugw2Bqlu8C2api6kKRN4AaABAg,"Respect om om tim pensiunan dan tim ojol disebelumnya, kalah di babak 3 tidak masalah. Kalian tetap keren",0,10,2022-04-24T01:34:22Z
56,VIHkCb3d_uU,UgytVvJD9UXOPIgWy514AaABAg,"Mau kasih saran nih sama tim kreatifnya. Mending babak WIT daripada kayak gitu cara game dan penilaiannya, mending jadiin babak rebutan aja. Jadi nawarin provinsi yang belum pernah diambil dan pertanyaannya seputar provinsi tsb. Jadi pertanyaannya yg muncul bener2 dari seluruh Indonesia. Tipe rebutan  cepet2an jawab pakai bel bikin game nya berasa makin seru karena babak terakhir.",0,38,2022-04-24T01:00:21Z
57,VIHkCb3d_uU,Ugz4xz2XgnsIixcHx654AaABAg,"Agak susah sih, yg di babak WITA itu kayak menentukan banget. Aku kira per babak (WIB, WIT, dan WITA), siapa yg menang dapat 1 poin gitu, mngkin next TWK musim selanjutnya bisa dibenahi untuk aturan mainnya, terima kasih 🙏<br><br>Dan tambahan, mungkinn bisa diberikan pertanyaan yang berlevel, misal level mudah, menengah, dan susah. Jadi Tim Riset Narasi harus bisa mengobrak abrik setiap provinsi di Indonesia untuk bisa menentukan soal dengan level yang berbeda2, mungkin seperti itu untuk saran di TWK musim depan.",2,19,2022-04-24T00:31:16Z
58,VIHkCb3d_uU,Ugy7AmIU5qGNHxn4Fkd4AaABAg,Ini yang paling keren sih sama2 cerdas dan berwawasan jd seru,0,0,2022-04-23T23:30:14Z
59,VIHkCb3d_uU,Ugw4_3Ohu6MJHJFnO994AaABAg,Kukira sungai terpanjang di jawa tengah itu sungai serayu,0,0,2022-04-23T23:22:27Z
60,VIHkCb3d_uU,UgwE2VXRa-OR4u05tsh4AaABAg,"Min min minnn,.<br>Perempat final udah 2x episode dan menurutku Waktu Indonesia Tangkas aga kurang fair,.<br>Yaa memang ini menguji pengetahuan secara spontan dan cepat, bagus sih,.<br>Tapi saran mungkin penyebutan nama untuk lawannya diilangin, jadi nyebutin jawabannya aja,. Biar tektokannya juga enak,. Nah untuk urutan siapa yg jawabnya yaa berurutan aja sesuai berdirinya peserta,.<br>Kayanya dengan ditambah penyebutan nama peserta akan mengganggu fokus peserta, aga sayang ini kemaren tim ojol dan sekarang tim pensiunan gagal karena gagal fokus, padahal 2 tim ini pengetahuan umum nya juga ga kalah hebatt,.<br><br>Tapi tetep,. Selamat tim politikus mudaaa, kalian hebatt jugaa, kerennn seruuuu!!!<br><br>Ditunggu next episodeee",0,10,2022-04-23T22:51:22Z
61,VIHkCb3d_uU,UgzVb5xmdYhX_ghTvDZ4AaABAg,"Dari kemarin babak ketiga ga seruu sumpah, tingkat kesulitannya beda sama babak-babak sebelumnyaa, mana yang saya jagoin dari kemaren sampe hari ini kena comeback di babak ini lagii, hadeehhh. but good job lah buat tim narasii udah bikin konsep gini, Semangatt 🌻",1,23,2022-04-23T21:52:32Z
62,VIHkCb3d_uU,UgyMY-aRaWmMepZN_Z94AaABAg,Nonton ini pas saur dikira pak helmi yahya yg bawain acaranya,0,0,2022-04-23T21:41:47Z
63,VIHkCb3d_uU,UgzgFv81XFefXTZghRB4AaABAg,babak ke 3 gak adik,0,0,2022-04-23T21:39:34Z
64,VIHkCb3d_uU,Ugx-0Uasj6iDRlkx-bx4AaABAg,Hadeuu kalah nyesek di babak ke 3😭😭😭,1,1,2022-04-23T21:30:38Z
65,VIHkCb3d_uU,UgyZQZDpXnPQXdVScwF4AaABAg,keren ni acara,0,0,2022-04-23T21:03:33Z
66,VIHkCb3d_uU,UgzYrvv7lmlgoMX7HPR4AaABAg,Babak ke 3 poin yg di dapat terlalu besar kasian team yg udah bikin strategi rebut pulau malah kalah dengan adu kecepatan berfikir,0,3,2022-04-23T20:50:41Z
67,VIHkCb3d_uU,UgwoOqJG8nJzY-Bi8nl4AaABAg,"Babak ke 3nya bikin kurang seru, harusnya babak ke 3 buat babak pertama aja, yang bener bener wawasan yang diujinya, bukan ketangkasan aja",0,1,2022-04-23T20:17:22Z
68,VIHkCb3d_uU,UgxJUo7HV-EZTnJs3kh4AaABAg,Ah sedih tim pensiunan kalah😭 dukung tim pensiunan padahal,0,1,2022-04-23T19:23:28Z
69,VIHkCb3d_uU,UgybNktRV9G5R2hFv7d4AaABAg,"Jujur aku suka sama Tim Ojol sama Pensiunan,huhuhu sedih bat  harus gugur. Padahal menurut ku beliau2 patut lanjut dengan pemikiran dan pengetahuan. Kek lebih worth gitu wkw",3,49,2022-04-23T18:58:57Z
70,VIHkCb3d_uU,UgyrJSEYvvspqy_brZJ4AaABAg,menurut aku sih game trakhir kurang efektif soalnya terlalu banyak point kaya tim ojol kmarin dia menang di babak 1&amp;2 tapi karna nama band mereka kalah <br>sama yang ini kalah di game trakhir <br>jadi kaya nya kurang efektif deh,0,6,2022-04-23T18:51:31Z
71,VIHkCb3d_uU,Ugz_vAb-m3sV3DGhk614AaABAg,Nostalgia kuis2 pak helmi yahya,0,0,2022-04-23T18:39:43Z
72,VIHkCb3d_uU,Ugz3AmphbyBKbZgTCp54AaABAg,Kurang fair babak 3,0,1,2022-04-23T18:12:29Z
73,VIHkCb3d_uU,Ugzi3m7vr7sSQ2oQwzB4AaABAg,Harusnya babak 3 nya 2 poin aja per orang sedih bgt 2 tim kalah karna babak bonus aje WKWKWKA,0,0,2022-04-23T17:46:06Z
74,VIHkCb3d_uU,UgxPB5XHHqP3Qj1pb5V4AaABAg,Babak bonusnya gila bgt,0,0,2022-04-23T17:45:02Z
75,VIHkCb3d_uU,Ugwwmah3t2VWRdIjL6p4AaABAg,"Andai twk cpns soalnya semudah ini hhuhu, btw asik keknya kalo bisa ikutan main di situ 🤩🤩",0,1,2022-04-23T17:30:55Z
76,VIHkCb3d_uU,Ugz08-MV1z4BkMPx8Gt4AaABAg,Babak 3 agak kurang cocok sih utk babak terakhir. Mending rebutan pake bel,0,1,2022-04-23T17:23:14Z
77,VIHkCb3d_uU,UgzsH3aJxLwKd6kP6FN4AaABAg,lagi-lagi yg lolos bukan tim yg emang berawawasan Luas gara-gara tes stage terakhir yg gak logis aja poinnya 😅,0,1,2022-04-23T17:13:29Z
78,VIHkCb3d_uU,Ugzl5SOkXPj8S6KW6_t4AaABAg,seruu bangeeettt,0,0,2022-04-23T17:03:04Z
79,VIHkCb3d_uU,UgxSpcV46RwmPU5KhIJ4AaABAg,"tolong diperbaiki sistem nya, setuju sama komentar tmn-tmn yg lain. agak kurang adil, di sesi 3, akumulasi pint di babak 1-2 percuma sia-sia dan yang perlu digaris bawahi, bobot pertanyaan nya harus diperhatikan lgi, kalau mau memberikan edukasi bagi penonton ya dari pertanyaan mugkin harus agak lebih berbobot dan adil ya, pertanyaan pulau jawa dengan sumatera berbeda jauh bobot nya. semoga jadi masukan yang membangun, dan dapat diperbaiki...",0,16,2022-04-23T16:58:15Z
80,VIHkCb3d_uU,UgyRZNuFuHVdwhzbj4Z4AaABAg,Bisa colab sama Pak Helmy Yahya untuk bantu bikin pertanyaan.,0,0,2022-04-23T16:45:28Z
81,VIHkCb3d_uU,UgyIZ7A1Lngd787W-rB4AaABAg,soal untk politikus muda gampang2 bget njir,0,0,2022-04-23T16:42:47Z
82,VIHkCb3d_uU,UgwbHBZLoQ3njUsnpsh4AaABAg,Semakin seruu,0,0,2022-04-23T16:34:10Z
83,VIHkCb3d_uU,Ugw7-_SifTLOE70PTd54AaABAg,tim pensiunan tinggal dikit lagi padahal :&quot;,0,0,2022-04-23T16:33:17Z
84,VIHkCb3d_uU,UgwM-Rb5D9RVYIdoP7p4AaABAg,"wildcard for tim pensiunan. anw babak 3 ini emg momok bgt hrs bisa mikir cepet. strateginya nunjuk satu tim lawan yg sma sampe trus menerus, habis pikir, gugur",0,4,2022-04-23T16:17:45Z
85,VIHkCb3d_uU,UgyZHQhQvm6FD-7vsE14AaABAg,mantep,0,0,2022-04-23T16:10:31Z
86,VIHkCb3d_uU,Ugy_lpU6x7OtpRQRGEF4AaABAg,Mantab pensiunan,0,0,2022-04-23T16:03:00Z
87,VIHkCb3d_uU,UgzWWAzBrWxhQf576nN4AaABAg,gampang banget pertanyaan tim politikus muda,0,0,2022-04-23T15:58:52Z
88,VIHkCb3d_uU,UgzX495SwOnfDS3xO8t4AaABAg,"keren nih episode, gada yg pure ngandelin hoki",0,1,2022-04-23T15:49:20Z
89,VIHkCb3d_uU,Ugys-sJzdPdgN1rLRd54AaABAg,"kejuaraan berikutnya yg lebih ekstrim pesertanya, kreator only pens misal hehe",0,0,2022-04-23T15:48:49Z
90,VIHkCb3d_uU,UgztVPIKRAYftziVIat4AaABAg,ehem bukan✨,0,0,2022-04-23T15:48:28Z
91,VIHkCb3d_uU,UgwUbZMPm4MWzE7Bpbp4AaABAg,politikus muda main aman mulu pilihnya di pulau jawa wkkwkwkw,0,1,2022-04-23T15:40:19Z
92,VIHkCb3d_uU,Ugxqq7BflXTaONalfJt4AaABAg,game ke tiga oper power langsung come back,0,0,2022-04-23T15:27:32Z
93,VIHkCb3d_uU,UgwAyUE1-bRXYVrIOF54AaABAg,"Dari dua episode perempat final ini saya melihat babak ketiga menjadi momen yang sangat menentukan pemenang, dimana menurut saya babak ketiga lebih banyak tuntutan ke berpikir cepat dan dalam tekanan dibanding berpikir tepat dan strategis seperti babak - babak sebelumnya. Sepertinya tim ojol dan tim pensiunan sebelumnya tidak terbiasa/gugup dengan tipe tektokan seperti ini sehingga menjadi momen pembalik keadaan. Saya pribadi merasa agak kurang adil dengan babak ini. Namun, saya rasa panitia punya diskusi panjang dan skenario2 tertentu yang sudah dipikirkan matang sehingga babak ketiga memang diperuntukkan untuk tetap memberi ruang harapan sebuah tim tetap menang kendati skor terpaut jauh.",17,192,2022-04-23T15:22:02Z
94,VIHkCb3d_uU,Ugx4dcnyprnXpmIUVhx4AaABAg,ini nih yang di tunggu&quot;.Kali ini persaingannya sengit banget...seruuuuuu,0,2,2022-04-23T15:20:26Z
95,VIHkCb3d_uU,UgwhbcoVdcpNs6lMhjt4AaABAg,ada 3 calon koruptor,0,0,2022-04-23T15:12:07Z
96,VIHkCb3d_uU,UgzKeRqmhRbLIoigs4h4AaABAg,"politikus muda pertanyaannnya mudah2 banget, om2 pensiunan luar biasa ilmunya",0,15,2022-04-23T15:00:38Z
97,VIHkCb3d_uU,UgzYc3dVNg0ivZrea194AaABAg,Politikus muda nampak terlihat seperti olig*ki muda 😔,0,1,2022-04-23T15:00:12Z
98,VIHkCb3d_uU,Ugydpyi8EjLodMSMxx14AaABAg,Semoga tim pns yg masuk di babak semi final. Menantikan politikus muda vs pns soalnya 🤟,1,2,2022-04-23T14:59:58Z
99,VIHkCb3d_uU,UgxtgWvsw8mzdNuTcU54AaABAg,Paling benci klo sudah di geme terakhir. Kaya nda adil huhu😭,1,5,2022-04-23T14:52:36Z
